priods,priods_date,title,works_date,author,view_counts,like,bullet_screen_counts,video_label,video_link
36,1574352000,73分钟看完柯南所有剧情！史上最全时间线整理！,1574857214,黝黑蜗壳天眼老师,8091943,860314,107285,一起重温柯南剧情吧！,https://b23.tv/BV12J411X7cD
36,1574352000,梦幻共舞！猛男原班人马手把手教你跳加减乘除（猛男版新宝岛）,1574799676,张恩恩NNN,3882880,339411,22970,原味的超实用新宝岛教学视频~,https://b23.tv/BV14J411X7xk
36,1574352000,B站三大恶人,1574592641,二哥日记本,8433748,435983,17032,北有工耿 南有华农 一旦不出 谁与争锋,https://b23.tv/BV1QJ41197sq
36,1574352000,一分钟后抢走你的硬币，小 丑 派 大 星,1574823629,君寻玩剪辑,8310489,819631,8187,如果派大星变成了小丑……,https://b23.tv/BV1aJ411X78q
36,1574352000,【防抑郁必备】改编魔性神曲《coincidance》送给键盘侠和杠精们,1574486019,拉宏桑,3435232,378778,8114,杠精之歌起，let's dance！,https://b23.tv/BV1xJ411d72m
36,1574352000,英 雄 联 盟 全 英 雄 介 绍（共146个）,1574457999,晏策去月光林地了,9123125,674226,69168,,https://b23.tv/BV17J411d7FJ
36,1574352000,【朱一旦】112 沉默在尖叫,1574772452,朱一旦的枯燥生活,4968692,318808,7096,不要把最坏的脾气，留给最亲近的人,https://b23.tv/BV1LJ411X7iZ
36,1574352000,【三周年】9分钟看完200个破产女神小姐姐！（Lolita/JK制服/汉服),1574415043,一夜北风吹,2343409,146021,11341,满屏的神仙美颜，截图准备！,https://b23.tv/BV1vJ41127tC
36,1574352000,网易是世界最好的公司,1574827255,不知耻の紫烟老师,6094822,454279,19636,,https://b23.tv/BV1YJ411X7x3
36,1574352000,【片片】这是什么神仙沙雕剧，笑得我打鸣一百次，爆笑吐槽《从前有座灵剑山》,1574688057,小片片说大片,2939750,115503,25628,沙雕修仙局，拯救枯燥,https://b23.tv/BV1aJ411R7Wy
36,1574352000,【官方MV】G.E.M.邓紫棋《句号》,1574391376,大家的音乐姬,5267055,279197,44779,,https://b23.tv/BV1RJ411R7tF
36,1574352000,香港警察：你们吃面包，我去吃海底捞！结果他们真去了……,1574519786,共青团中央,8862684,439734,15920,港警们的劝降语录上新啦,https://b23.tv/BV1wJ411o73s
36,1574352000,我被家暴了，这次我不再沉默,1574685884,宇芽YUYAMIKA,7835837,583798,95540,,https://b23.tv/BV1YJ411R7CE
36,1574352000,【慎看】那些颠覆你价值观的“两性生理差异”！,1574495930,知心者联盟,6021809,597811,48073,这里有你好奇的男女差异小知识，了解一下吧,https://b23.tv/BV1kJ411d7P1
36,1574352000,中国人唱给美国的魔性RAP,1574347688,共青团中央,5448453,601296,13476,,https://b23.tv/BV1zJ411271R
36,1574352000,【完整版】香港金融保卫战，国际巨鳄索罗斯做空英镑泰铢，决战香港,1574667095,观视频工作室,4350270,296712,28985,我在B站学习系列,https://b23.tv/BV1pJ411R7KZ
36,1574352000,我叫焦糖布丁，我被这个人做成了吃不起的样子,1574414656,大碗拿铁,9018088,892082,14769,好想吃到这样的布丁,https://b23.tv/BV1dJ411R77H
36,1574352000,【金星老师揭露浙江卫视】【高以翔录节目猝死】【浙江卫视】内部混乱有内幕，竟连对一个艺人最起码的安全急救措施都没有做到位？,1574828687,油管大神Youtube,1874428,39625,948,,https://b23.tv/BV1vJ411X7jY
36,1574352000,年度最沙雕名场面，up主看完后笑疯了,1574936645,LexBurner,4624809,214669,28882,超人高中生们即便在异世界也能从容沙雕！,https://b23.tv/BV17J411977U
36,1574352000,【倒放挑战】我们俩像弱智...,1574665777,徐大虾咯,7965538,353510,59928,喜闻乐见两个铁憨憨,https://b23.tv/BV1nJ411R7Py
36,1574352000,网易辞退身患绝症的游戏策划 冷风吹散了热爱,1574669303,独立菌儿,3045187,217140,9400,,https://b23.tv/BV1pJ411R7Ut
36,1574352000,这个up主开挂了！居然在家甩出了印度飞饼,1574754939,绵羊料理,7494545,577854,18950,亲手甩飞饼，小心防打脸,https://b23.tv/BV1KJ411X7xV
37,1574956800,【疯狂华语乐坛2009】原来这些耳熟能详的歌曲都是10年前的，真是个疯狂的年代啊！,1575432840,音乐Wu哥,3797878,125544,91029,一首歌一记回忆杀，竟然已经10年了……,https://b23.tv/BV1ZJ411q7Xj
37,1574956800,英语课表演卢本伟“17张牌你能秒我”,1575176817,NiNH42SO426H2O,10213391,488572,16127,这位同学的英语配音技能太强了,https://b23.tv/BV1AJ411z7xf
37,1574956800,【全明星】我 和 你 荡 秋 千,1575277269,潮汕好男人,6880695,433653,71962,我和你荡秋千，荡到了高压线,https://b23.tv/BV1cJ411z7t2
37,1574956800,【武林外传】因为抖肩，所以聚首,1575017109,_青红造了个白_,5602810,501127,8957,没有燕小六吹不了的曲子，没有白展堂跟不上的节奏,https://b23.tv/BV1MJ411Q7bx
37,1574956800,【咬人猫】芒种 ❤️ 一想到你我就……,1574808382,=咬人猫=,4144159,124220,7149,仙女在雪山下跳舞啦,https://b23.tv/BV1bJ411X7nN
37,1574956800,"医保局专家""灵魂砍价""，企业代表当场流泪！",1575355543,央视新闻,1950328,91160,10993,为老百姓砍价的医保局专家，太帅了,https://b23.tv/BV1bJ411q7oA
37,1574956800,没内味儿？《野狼disco》改编古风版（听完你还会唱原版吗）,1575092885,杨可爱Ukulele,4493574,355029,11544,古风填词+戏腔，倍速版绝了,https://b23.tv/BV1BJ411Q717
37,1574956800,【温柔JUNZ】来自世界的温柔！豫章书院创作激励的捐款实录。,1574967654,温柔JUNZ,3726968,768866,28215,愿世界多一些像温柔一样的阳光,https://b23.tv/BV1mJ411D7nj
37,1574956800,当英雄拥有6000%极限攻速：圣枪洗脸、光速连跳、一秒50环......,1575370806,葡萄的叮当猫,3627361,146939,6291,极限攻速，自带鬼畜太爽了,https://b23.tv/BV1mJ411q7Jn
37,1574956800,【朱一旦】114 不管影响是大是小，至少今天我真实存在,1575290550,朱一旦的枯燥生活,3213197,117511,3149,,https://b23.tv/BV1ZJ411z71P
37,1574956800,华农兄弟：猪吃酒糟醉了，叫兄弟帮忙一起宰猪，烤起来很香哦,1575084611,华农兄弟,7779632,267022,62942,村霸磨刀，这回轮到黑猪了,https://b23.tv/BV11J411D7D2
37,1574956800,真实●当你打开手机仅仅想查个单词时,1574910042,Huuo嗖,3098411,280328,6597,是谁在监控我的学习日常？,https://b23.tv/BV1gJ411977f
37,1574956800,中国CHINA！3分钟感受来自中国的声音，全程鸡皮疙瘩超震撼的宣传片！,1575124918,浙江共青团,5545020,525734,49172,,https://b23.tv/BV1CJ411B7cT
37,1574956800,逐   渐   暴   躁,1575002405,桃色弥情Selvin,5105996,275861,17829,在B站看戏成功！有点上头,https://b23.tv/BV1uJ411Q7Gw
37,1574956800,我都吃了一整锅红烧鱼，怎么还没饱？难道因为我的灶台是mini版？,1575071724,永恒跳动的火焰,2924704,222429,10992,吃鱼？但我怎么好像在看过家家？,https://b23.tv/BV1aJ411Q77A
37,1574956800,《黑寡妇》首发预告曝光！白衣寡姐美如画,1575368614,努力的Lorre,1903080,61940,2662,寡姐太飒了！,https://b23.tv/BV11J411q7Fa
37,1574956800,村里起鱼，老爸买了十多斤，大sao做全鱼宴下酒，烤鱼烧鱼吃过瘾,1575455436,徐大sao,1392708,44319,6793,大SAO上得厅堂下得厨房！看馋了,https://b23.tv/BV1ZJ411q72T
37,1574956800,自制拳击背包,1575123596,手工耿,4687697,255139,17148,手工耿也拥有了“替身使者”,https://b23.tv/BV1CJ411B7gh
37,1574956800,厨师长教你：“酸辣大白菜”的家常做法，酸辣又开胃，收藏了,1575264796,美食作家王刚R,2426705,71269,2875,炒白菜还需要进行“技术总结”？！,https://b23.tv/BV1aJ411z7z9
38,1575561600,【黑寡妇】预告，娜塔莎·湘玉震撼来袭！,1575896997,_青红造了个白_,4135312,179856,3344,论剪辑，口型都对得上是最厉害的,https://b23.tv/BV1NJ411y7HV
38,1575561600,【朱一旦】119 又到了每个月的颁奖环节，这次特意找了个知名主持,1576064127,朱一旦的枯燥生活,3607949,124796,3770,官方消息，朱一旦的英文名公开了（?）,https://b23.tv/BV1EJ41117zW
38,1575561600,为什么说Photoshop 2020是最适合萌新入门的版本？,1575720249,苏噗噜Supuloo,1294956,107296,963,学习表现好的话，Adobe爸爸会给你夸夸哦,https://b23.tv/BV1zJ411e7az
38,1575561600,奥利给妙妙屋,1575950431,枪弹轨迹,22209992,872258,50503,米奇奥利给屋，开启！快进来，非常好玩~,https://b23.tv/BV1GJ411y7ui
38,1575561600,我不停努力，只是为了不让这个世界来改变我,1576080891,槐安遗梦,4989727,311840,58850,作为一个游戏up主，这相声说的也太好听了,https://b23.tv/BV12J411k77r
38,1575561600,一想到你我就.....腾格尔版《芒种》真的来了！,1575628229,腾格尔,3582537,225827,5670,当萌叔遇上清新古风，惊人的匹配度,https://b23.tv/BV1bJ411i711
38,1575561600,全程高燃（沙雕）！激情解说火影忍者最巅峰的一战！,1575700549,LexBurner,5232422,355287,35540,泪目！经费爆炸！,https://b23.tv/BV1jJ411q7aw
38,1575561600,【朱广权新Rap】央 视 新 闻 来 B 站 了！,1575802054,央视新闻,3717964,463641,24667,确认过眼神，你是有眼光的人！,https://b23.tv/BV1JJ411v7A2
38,1575561600,史上最骚配音,1575798151,冰雕视听,5379774,487740,19236,B站有善口技者，在线高能配音，太像了,https://b23.tv/BV17J411v7LF
38,1575561600,"我很失望！华春莹问""你们有谁看过吗？""，外媒无一举手",1575900270,共青团中央,4112761,224480,26,,https://b23.tv/BV1jJ411y74u
38,1575561600,请问up，这个人偷摸在桌子底下看的是啥番？有点刺激！【阅片无数26】,1576072852,凉风Kaze,3150699,265270,36232,找番工具人如何逐渐变成人工智能识图搜索引擎？,https://b23.tv/BV1rJ411y7bA
38,1575561600,"【猛男舞团】新宝岛remix 宴 请 八 方【BML2019广州单品】",1575734159,BML制作指挥部,13416150,614686,72093,前后踩点，战术甩头，这场live我出不去了啊,https://b23.tv/BV1SJ411e7c9
38,1575561600,熬夜之后如何科学恢复,1575986850,哈百里,3799600,236235,135,熬夜之后的一天应该怎么安排？来学习一下,https://b23.tv/BV1rJ411y7Mj
38,1575561600,【第一弹】CGTN重磅披露涉疆反恐部分案件、画面！用事实揭露美国“双标”嘴脸,1575629040,央视新闻,1320262,79918,0,,https://b23.tv/BV11J411i7RJ
38,1575561600,【老番茄】史上最骚杀手(第七集),1575441437,老番茄,15703933,855749,67489,有生之年，杀手系列更新了,https://b23.tv/BV1FJ411B7Qg
38,1575561600,华农兄弟：小狗崽和小猪崽长肥了不少，看起来圆溜溜，胖墩墩的,1575894723,华农兄弟,2542726,110835,18674,胖乎乎的小奶狗，太可爱了,https://b23.tv/BV1cJ411y7jc
38,1575561600,倒放挑战！地狱级难度！！,1575872712,中国BOY超级大猩猩,7195699,379036,65122,这个挑战，有内味儿了,https://b23.tv/BV1dJ411v7Rk
38,1575561600,“我想跟你在一起”,1575625509,锦书致南辞,5618090,258337,46959,成吨的高甜影视狗粮，进来就别想走了,https://b23.tv/BV11J411i742
38,1575561600,自制闻味儿解馋器,1575976453,手工耿,3686549,170585,15428,闻着味道，不会越来越馋吗,https://b23.tv/BV1YJ411y7nq
38,1575561600,B站第一只烤全鸵鸟来了，靓仔花费9000元烤了一只全鸵鸟，160斤没有专业工具可以烤得熟吗,1576042904,衣谷水原egg,1486520,245579,13439,你烤鸵鸟的样子真的很靓仔,https://b23.tv/BV1KJ41117hK
39,1576166400,炮姐归来！阵容炸裂！2020年1月新番导视！,1576814463,LexBurner,5071198,350368,45256,新鲜出炉！来看看即将伴随我们过寒假的新番有哪些吧,https://b23.tv/BV1AJ411b7TF
39,1576166400,【何同学】脆弱的美好 折叠屏手机深度体验,1576228088,老师好我叫何同学,6751314,730542,29565,这翻转酷炫的折叠屏，它香吗？,https://b23.tv/BV1aJ411C7tb
39,1576166400,试吃全世界最贵的火腿！切下八小片就能卖四百的伊比亚火腿！,1576672396,敬汉卿,7947063,467139,17011,什么火腿能比我的金锣还好吃？！,https://b23.tv/BV1KJ411t7KM
39,1576166400,【朱一旦】122 今天收藏了一幅世界名画——《蒙娜旦莎》,1576760163,朱一旦的枯燥生活,3674255,106037,1571,有钱人，就是可以收藏私人订制版的蒙娜丽莎,https://b23.tv/BV1DJ411t7X9
39,1576166400,【妈妈问我为什么跪着听完】日本高校天朝留学生真还原《Into The Unknown》！全站最秀的翻唱！带你领略四国语言的魅力！,1576304726,是小光芒呀神秘组织,6131247,408528,8745,开口跪！四国语言翻唱艾莎主题曲，太好听了吧,https://b23.tv/BV1pJ411r7wQ
39,1576166400,【年度混剪】2019年终盘点：奉献，为了你挚爱的一切,1576215407,NOOB酱,2747472,284354,18532,2020即将来临，给我们的2019画个句号,https://b23.tv/BV1iJ411C7Nx
39,1576166400,每天一遍，防治抑郁,1575985129,猎奇笔记本,4299645,262314,6618,前方高萌预警，治愈你的心,https://b23.tv/BV1DJ411y7st
39,1576166400,我是如此相信（《天火》电影主题曲）- 周杰伦,1576465031,大家的音乐姬,2384400,88770,11497,我才不会告诉你1.25享用才是我熟悉的杰伦,https://b23.tv/BV1AJ41167HL
39,1576166400,十年破站无人问 一朝成名天下知 辞去已无年少日，羁绊永结少年心！,1576341429,战场ヶ原-,5544256,488754,96870,下个10年我们依旧在，干杯！,https://b23.tv/BV1dJ411r7SF
39,1576166400,黑衣人亲自演奏《名侦探柯南》中最经典的3首配乐！你一定听过！,1576352761,绯绯Feifei,9149457,355229,45270,大家一起说害怕！好像就没那么害怕了耶,https://b23.tv/BV1SJ411r7Gg
39,1576166400,【老番茄】我去做建筑师(?)了！,1576202236,老番茄,6593835,297028,26820,老番茄变身圣诞老人来送礼啦,https://b23.tv/BV15J411C7Rr
39,1576166400,【藏】南京大屠杀死难者国家公祭日【风鸣社】,1576151690,共青团中央,1436151,212232,26536,勿忘国耻，吾辈自强,https://b23.tv/BV1cJ411C7Dg
39,1576166400,羊     村     摇,1576471372,白日失眠崽崽子,3745834,198950,5936,jojo的奇妙冒险之青青草原羊村篇,https://b23.tv/BV1jJ41167z6
39,1576166400,抖音上曝光的肯德基原料是真的吗？小伙一次性全买来求真！,1576469320,记录生活的蛋黄派,4936037,298072,18628,肯德基大师来尝试复原KFC产品了，结果怎么样呢,https://b23.tv/BV1VJ41167yb
39,1576166400,大sao花几百块做佛跳墙，三年的母鸡吊高汤，鲍鱼海参压底，实在,1576665032,徐大sao,2051656,72213,15440,听见了经费燃烧的声音！这顿真好！,https://b23.tv/BV1EJ411k7So
39,1576166400,历史上的鼠疫有多可怕？了解下当年的疫情黑死病【思维实验室】25期 鼠疫 黑死病,1576486853,思维实验室,6895941,430343,67135,致敬！医学拯救人类！黑死病我也不怕怕~,https://b23.tv/BV1kJ411r7cX
39,1576166400,b 站 热 度 年 度 总 结 ☆【禁止套娃2019】,1576297724,高坂大芥末,6326831,417637,41617,前方高能，和我一起摇摆~,https://b23.tv/BV1nJ411r7FQ
39,1576166400,喵：我的套票里没有搓澡，你不要强制消费！ 铲屎官：那你也不能口吐莲花啊！,1576463176,金渐层沈同学,6292639,184431,7501,疯狂叫唤不愿意洗澡的小喵喵,https://b23.tv/BV1AJ41167B9
39,1576166400,【澳门回归20年】廿念澳门 重温《七子之歌》,1576477720,央视新闻,408733,25986,3054,祝福澳门更加繁荣，祝福祖国更加强大,https://b23.tv/BV1uJ411673n
39,1576166400,华农兄弟：摘点大叔家的香菇，捉2只兄弟家的小鸡，做小鸡炖蘑菇,1576511435,华农兄弟,3207021,145401,35635,村霸去摘隔壁村大叔家的香菇了！,https://b23.tv/BV1bJ41167zW
39,1576166400,这个游戏开始无限俄罗斯套娃！,1576607448,中国BOY超级大猩猩,3045925,204899,15479,王先生，您的看鬼畜呢？我在认真做游戏！,https://b23.tv/BV1uJ411r7en
39,1576166400,自改弹簧条车轱辘,1576577663,手工耿,3550016,135770,8893,这难道是手工耿的第一个翻车现场了吗,https://b23.tv/BV1XJ41167mz
39,1576166400,学校领导：???     晚会你给我整这个？,1576215902,清水龙潭插竹竿,7738827,464018,31417,这样的同学，确定不是专业的配音演员？,https://b23.tv/BV1iJ411C78Z
39,1576166400,创业记录2: 央视跟拍我们咖啡庄园，第一批已经寄美国！,1576556325,我是郭杰瑞,1688713,115648,7286,郭杰瑞被拍进央视网和B站的纪录片里啦！优秀！,https://b23.tv/BV16J41167C5
40,1576771200,古力娜扎这次唱出了我的心声,1577084470,倒悬的橘子,3125977,125535,5924,欢迎娜扎加入B站鬼畜全明星,https://b23.tv/BV1ZJ411s712
40,1576771200,【冯提莫】每 天 一 遍，防 止 抑 郁,1577015592,冯提莫,1946311,73227,5347,自己鬼畜我自己，我是真的真的很不错,https://b23.tv/BV1tJ411s79v
40,1576771200,盗  梦  空  间,1577102565,天秀宝宝baby,4838187,243675,4762,“世纪科幻大制作”，太震撼了,https://b23.tv/BV1MJ411x7tQ
40,1576771200,【主播真会玩特别篇】：2019年游戏混剪,1577105549,是大腿,1427889,76429,3873,热爱游戏，热爱生活，2020也要加油啊,https://b23.tv/BV1TJ411x7iu
40,1576771200,治愈系日文版《好想爱这个世界啊》翻唱 「华晨宇」,1576935433,-TOKUCHI-,9587065,733296,38585,太好听了！听不了吃亏听不了不上当！只会幸福！,https://b23.tv/BV1hJ41147EE
40,1576771200,【朱一旦】123 寻“密”十八岁,1576928942,朱一旦的枯燥生活,3014910,135063,17014,朱一旦原声出演了！,https://b23.tv/BV1HJ41147Xi
40,1576771200,【徐锦江】B站我来了！“硬核”圣诞老人鳌拜入驻了！,1577263985,徐锦江,6598751,633778,30475,好喜欢这个又凶又可爱的圣诞老人啊,https://b23.tv/BV1BJ411W71f
40,1576771200,建 议 改 成 建 议 建 议 改 成：工  具  人,1576903864,两只撸sir-,5124308,285355,6824,如果人人都能少一点套路，世界将变成更美好的人间,https://b23.tv/BV1uJ41147Zk
40,1576771200,15万买钻戒求婚，女友直接把我推开！,1576896316,力元君,7367105,1013928,171328,恭喜UP主！等着看婚礼！！！,https://b23.tv/BV1FJ41147aC
40,1576771200,2019年，哪些话语让你印象深刻？,1577168064,央视新闻,479070,41551,0,铿锵有力的呐喊，掷地有声的回应，饱含热忱的自白,https://b23.tv/BV1hJ411x7ih
40,1576771200,只带一个锅能白嫖一顿火锅吗？阴阳怪气陪你过平安夜！,1576870769,中国BOY超级大猩猩,11050398,657612,254734,阴阳怪气真就出团综了呗，这白嫖姿势我学会了,https://b23.tv/BV1FJ41147G5
40,1576771200,2019年度动画混剪，我们度过的每一个日常，正是连续发生着的奇迹,1576836961,泛式,1120539,96505,5890,泛式重拾MAD老本行系列,https://b23.tv/BV1zJ411x77r
40,1576771200,【庆余年手书】范闲和二皇子的抖肩舞（by再临）,1577174647,再临临,2483492,258889,7486,人物画得都太传神了！萍萍起立的医学奇迹值得一看！,https://b23.tv/BV14J411x71Z
40,1576771200,【注意！】那些正在“毒害”年轻人的“伪知识”！,1576854647,知心者联盟,10714647,844335,67804,不吃早饭等于吃翔？鸡蛋和豆浆不能一起吃？,https://b23.tv/BV1CJ411x7au
40,1576771200,拳王争霸× 菜鸡互啄√,1577373257,老番茄,15409640,645694,158597,三个游戏区up和一个生活区up的爱恨情仇,https://b23.tv/BV1aJ411Y74w
40,1576771200,跟 五 个 美 女 共 舞,1576893654,老坛胡说,1759560,175233,21809,9:10正片开始！画面太美，我裂开了,https://b23.tv/BV12J411x7xB
40,1576771200,爆笑盘点2019国产剧烂剧，哇你妹第二届颁奖典礼来啦！【哇妹】,1576925979,哇哇哇妹,2190142,66550,35509,都在玩尬的是吧？太好笑了哈哈哈,https://b23.tv/BV1HJ41147hW
40,1576771200,火锅之神在此！如何优雅地吃一个撒尿牛丸？,1576930305,毕导THU,1971973,217645,22706,吃货的较真！欢迎进来学习撒尿牛丸的花样吃法,https://b23.tv/BV1LJ411477W
40,1576771200,【才浅手工】魔刀千刃制作 究竟什么叫还原？看完你就明白了,1577251104,才疏学浅的才浅,16784780,2090043,209648,这是真的神仙up主啊,https://b23.tv/BV1tJ411W7hw
40,1576771200,吃一大罐军用东坡肘子！一口下去油腻的肥肉爽得飞起！,1577099230,敬汉卿,4315345,210081,11052,UP主没钱？你可是喝过82年拉菲的人,https://b23.tv/BV1dJ411s7K6
40,1576771200,南方人冬天洗澡有多难？？,1577005816,黄一刀有毒,3658231,261653,27778,欢迎收看：冬天洗澡群像,https://b23.tv/BV1QJ41147pS
40,1576771200,原来“东北烤冷面”是用这个制作的，以后再也不用去街上排队买了,1577179863,翔翔大作战,4330987,149067,11729,冬天来了！又到了吃东北烤冷面感受幸福的季节！,https://b23.tv/BV18J411x78P
41,1577376000,【全明星】2019鬼畜全明星大回顾,1577795727,OELoop,9188824,558649,39869,结   尾   高   能   ！,https://b23.tv/BV1yJ411h7qW
41,1577376000,【烙锅和缙云烧饼】当烙锅遇上缙云烧饼，你以为有故事？并没有！,1577827920,李子柒,3314087,273726,36110,新年到了，看着大雪吃贵州烙锅，想家了,https://b23.tv/BV1VJ411b7RK
41,1577376000,DC遗失的预告：比 奇 堡 黑 暗 骑 士,1577532355,君寻玩剪辑,2356542,182757,1572,良心UP主，作画和剪辑都太强了！毫无违和感！,https://b23.tv/BV1wJ411a7Go
41,1577376000,班长：对待新同志要有耐心，不要急躁。我不生气...不生气...生气...气....,1577409054,古咕古菌,3415221,133675,1451,班长：我太难了，这届新同志太难带了……,https://b23.tv/BV1kJ411Y7AJ
41,1577376000,【咬人猫】女仆装恋爱循环❤️加速版 &“腾格尔”版！,1577689294,=咬人猫=,5126760,161321,11154,如果BGM是“腾格尔”版的，咬人猫该怎么跳呢,https://b23.tv/BV13J411Y7BE
41,1577376000,【现 代 圣 杯 战 争】,1577436505,野纯Cz,33406511,1553687,56636,当你第一次点进来时，你并不知道以后还会来多少遍,https://b23.tv/BV12J411Y7jV
41,1577376000,圣 枪 游 侠,1577716665,纸巾y_,3083730,158671,6585,冲破次元壁的暴击！AWSL,https://b23.tv/BV1AJ411h7b5
41,1577376000,【完整版MV】腾格尔版的《芒种》终于来啦！完美诠释硬核柔情！,1577502613,梦幻西游电脑版,8742357,476886,44106,太好听了！原唱遇到对手了！,https://b23.tv/BV1uJ411e7ir
41,1577376000,【老番茄】史上最憨训练师(第一集),1578024059,老番茄,11570100,622984,49155,宝可梦！游戏画风引起舒适！,https://b23.tv/BV1ZJ411a7Dg
41,1577376000,2019年度佳片大盘点！最强的三部动画疯狂刷新历史记录！,1577606218,LexBurner,7214762,484777,69733,2019年新番小总结，都进来吹！,https://b23.tv/BV16J411a7e1
41,1577376000,《明日方舟》EP – Boiling Blood,1577758153,明日方舟,2233304,111510,4429,又是一家被游戏耽误的音乐公司,https://b23.tv/BV1NJ411h7MZ
41,1577376000,致  死  量,1577774592,海系魔法师,7256058,414487,25220,喵~这太萌了，犯规了！,https://b23.tv/BV1jJ411h7pK
41,1577376000,男女接吻真的会喘不过气吗？【阅片无数29】,1577872987,凉风Kaze,6894174,529435,113314,（？？？然而这跟我们单身贵族又有什么关系呢,https://b23.tv/BV1DJ411b7hh
41,1577376000,被无数人嘲笑的奥力给，其实是他对抗命运的怒吼,1577545701,老油条说,4676839,383993,17295,当他说“奥利给”时，他在说些什么,https://b23.tv/BV1VJ411a7Gj
41,1577376000,【唯美星辰】耗时三年拍摄完成的一部星空延时作品，你是否见过如此梦幻的璀璨星空！,1577792386,骑驴到西藏,674426,110610,3946,太震撼了！真实地感觉到了地球的转动,https://b23.tv/BV16J411h7rZ
41,1577376000,两斤肥肠蒸两斤面条，没出锅就被老婆嫌弃，剥一把大蒜，那是真香,1577874639,徐大sao,2174046,79192,17002,2020年第一餐，还得吃点好的！,https://b23.tv/BV1hJ411b7kD
41,1577376000,如何策划中国boy看鬼畜【完结篇】,1577791662,吃素的狮子,2071525,151488,9300,B站大型UP主合作整蛊事件揭秘,https://b23.tv/BV1bJ411h74X
41,1577376000,让我们一起来看鬼畜BOY（完结）,1577745773,中国BOY超级大猩猩,4736124,278088,62626,看完这期，就可以去补以前的看鬼畜系列了,https://b23.tv/BV13J411h7mj
41,1577376000,把最新科技人造蛋买来与国产素蛋对比！究竟哪一个更像蛋？,1577705592,敬汉卿,3183656,157947,7580,建议敬汉卿换一个不粘锅啊,https://b23.tv/BV1DJ41187qn
41,1577376000,两个UP主疯狂喷起来了【国基网骗-小潮tEam四周年特别版】,1577502068,小潮院长,3913334,250044,26106,槐安遗梦原声暴露了？,https://b23.tv/BV1KJ411e7Dv
41,1577376000,【朱一旦】126 虽然凝视深渊，但依旧心向光明,1577539389,朱一旦的枯燥生活,7390241,644233,23993,作为一名非医疗工作者，我郑重宣誓：尊敬医疗工作者,https://b23.tv/BV1ZJ411h7LU
41,1577376000,为什么纳豆奶奶在几个月内从少女变成了奶奶？,1577966715,纳豆奶奶,2722966,330173,31271,纳豆年纪轻轻，怎么就开始写自传了？,https://b23.tv/BV1LJ411j7x1
41,1577376000,刺客伍六七《下山》粤语萌妹版,1577333343,雪霏岚岚,5552969,337220,10146,我们的UP主都是神仙！可劲儿夸起来！,https://b23.tv/BV19J411W7Xu
41,1577376000,探秘美国海鲜业，中国吃货带火的波士顿龙虾要凉了？,1577676628,我是郭杰瑞,2612511,100963,14670,郭杰瑞告诉你，美国是个农业大国,https://b23.tv/BV1GJ411Y7k4
