priods,priods_date,title,works_date,author,view_counts,like,bullet_screen_counts,video_label,video_link
1,1553184000,这集vlog我们拍了十年，致最美好的青春,1553152210,AresserA-Vlog,4442281,472479,66263,暴风流泪推荐！今天也是为别人的神仙爱情流泪的一天！,https://b23.tv/BV14b411J7ML
1,1553184000,华农兄弟：兄弟家的鱼跑河里去了，帮他网回来，一网下去还不少,1553427013,华农兄弟,2413960,72641,21469,村霸兄弟又上线了！这次他们把魔抓伸向了兄弟家的鱼！,https://b23.tv/BV15b41147uu
1,1553184000,【性转版】回家的诱惑（刘亦菲/刘昊然/邓伦/吴磊/贾玲）,1552823023,兰彻lancche,4115144,223826,41325,,https://b23.tv/BV1xb411n7L6
1,1553184000,【敖厂长】20年前此暴力游戏火遍中国,1553150201,敖厂长,5481778,201767,16566,不看不知道，小学的时候还真的玩过诶！我的童年你怎么知道(ﾟДﾟ≡ﾟдﾟ)!?,https://b23.tv/BV1Wb411J7RS
1,1553184000,哆啦A梦结局背后的秘密？从未播出的黑历史？真相出人意料,1553365833,瓶子君152,2174899,143042,4465,,https://b23.tv/BV1Qb41177Vm
1,1553184000,【AI换脸】当洪世贤穿上品如的衣服,1552849498,用户名未填写,1421315,58145,2918,AI换脸必看视频！你……你怎么穿品如的衣服呀？,https://b23.tv/BV1vb411n76g
1,1553184000,在中国挑战通宵卖烧烤！为啥美国没有这个？,1553050747,我是郭杰瑞,2313338,65537,13467,,https://b23.tv/BV1Rb411E7yi
1,1553184000,脑瓜崩神器弹老外！耿哥出品，必属精品！,1553058274,毒角SHOW,1730740,46082,3081,,https://b23.tv/BV1ob411E7YH
1,1553184000,【纯黑】《鬼泣5》一周目无伤S评价攻略解说 第七期,1553499341,-纯黑-,1282083,59571,5567,,https://b23.tv/BV1Cb41147EK
1,1553184000,化身修罗只为守护你！此刻世界将为之颤抖！,1553256959,烟季,6444765,387226,15944,,https://b23.tv/BV1gb41177rt
1,1553184000,破案大师老番茄,1553227217,老番茄,5591334,121503,15178,,https://b23.tv/BV1Sb411j75C
1,1553184000,【党妹】24件春秋必备百搭卫衣分享/五五身窄肩平胸小矮子如何穿成阳光糖分美少（女）年,1553306428,机智的党妹,2135223,141683,19530,,https://b23.tv/BV1Eb41177VX
1,1553184000,[LPL春季赛] 3月23日 RNG vs IG,1553347232,哔哩哔哩英雄联盟赛事,3349866,36308,105356,,https://b23.tv/BV19b411774z
1,1553184000,the real suger baby已知最高画质,1551437298,一嗷垚,28121541,755127,21639,,https://b23.tv/BV16b411b71j
2,1553788800,女主人扮恐龙把猫吓的到处飞，直接六亲不认，一脱衣服，猫：妈？,1553851043,花花与三猫CatLive,2425096,117580,12656,调皮铲屎官又耍花招，装扮成恐龙吓唬猫咪！还是亲妈最会玩_(:3」∠)_,https://b23.tv/BV1Qb411x71C
2,1553788800,华农兄弟：狗狗走丢了一只，用无人机去找一下，看能不能找到,1553943626,华农兄弟,2858514,100542,11409,心疼村霸，希望剩下的那只狗子能够早日回家(´；ω；`),https://b23.tv/BV12b411W7WM
2,1553788800,【真人炉石】暗影崛起-最秀新卡发布！,1554044066,神奇的老皮VFX,4284724,296850,12971,强力推荐！真人版炉石传说，大片级特效秀翻全场！,https://b23.tv/BV1Bb411s7m9
2,1553788800,哎呀妈呀！不用烤箱也能做出这么棒的【流心芝士挞】吗？,1554205977,爱做饭的芋头SAMA,3201215,144965,3503,新技能get√ 高颜值甜品做法居然这么简单，你学会了吗？,https://b23.tv/BV1rb411p7W9
2,1553788800,1818黄金眼【在路上：打完电话 他爆发了】,1554046423,1818黄金眼,163940,4954,1848,成年人的生活中没有“容易”二字，几分钟的视频触动了无数网友 。,https://b23.tv/BV16b411s7NL
2,1553788800,[LPL春季赛] 3月30日 IG vs EDG,1553953445,哔哩哔哩英雄联盟赛事,2544489,32992,61415,20血极限翻盘！众所周知，英雄联盟是一款恐怖、紧张、刺激的回合制游戏……,https://b23.tv/BV1Db411W7FN
2,1553788800,号外！全新弹幕功能进入内测阶段！,1553835335,哔哩哔哩弹幕网,838196,31403,9305,,https://b23.tv/BV11b411x7VP
2,1553788800,比《复联4》更虐！漫威不敢拍的复联10次团灭,1553768279,努力的Lorre,2109880,58338,4389,,https://b23.tv/BV1hb411x7wM
2,1553788800,【游戏侦查冰】揭秘游戏氪金抽卡的“黑幕”,1553831102,芒果冰OL,2199920,219407,26759,,https://b23.tv/BV1yb411x7P3
2,1553788800,云南奇葩蔬菜竟这么多！为啥美国蔬菜品种都一样？,1554174011,我是郭杰瑞,1671913,51164,10589,,https://b23.tv/BV1Wb411p76H
2,1553788800,我是超杀女，我来了！,1554289159,科洛莫瑞兹ChloeMoretz,1321540,51594,2613,,https://b23.tv/BV17b411W7Yj
2,1553788800,【C菌】只能用耳朵玩的国产推理游戏！,1553826923,渗透之C君,1319393,66004,14853,,https://b23.tv/BV1rb411x7We
2,1553788800,点外卖的时候备注：”往死里加辣“会怎么样,1554211122,楼上的老张,3109498,100595,29805,,https://b23.tv/BV1Cb411p7TY
2,1553788800,靠谱盘点33：笑疯！Faker首次传授独家中单秘诀，厂长变身食肉型打野，各赛区爆笑吐槽,1553772612,靠谱电竞,1856066,140993,4659,,https://b23.tv/BV1qb411x7Dr
2,1553788800,【嘻咦啊看】这个抛妻弃子的男人赢得了所有人的喝彩,1554122366,嘻咦啊看,1492132,46885,10134,,https://b23.tv/BV1Vb411p7tP
3,1554393600,人类第一张黑洞照片，来了！,1554904794,二次元的中科院物理所,1323034,54587,22964,和B站小伙伴一起见证历史！黑洞到底长啥样？错过直播的你还不快点进来。,https://b23.tv/BV1Nb411M7r8
3,1554393600,破釜沉舟跑步机,1554694435,手工耿,9471585,328890,18106,脑洞发明家手工耿最新力作！如果你恨一个人，就送他这台破釜沉舟跑步机吧。,https://b23.tv/BV1eb411u7Pz
3,1554393600,【名师rap】游戏不打不成才,1554415633,伊丽莎白鼠,7490597,438681,24719,爷爷，你关注的鬼畜UP主终终终终于更新啦！还是熟悉的全明星阵容，还是曾经的味道。,https://b23.tv/BV1Yb411g7Mu
3,1554393600,随机理发！太丢人了！！早知道这样我还不如女装！,1554817240,吃素的狮子,1493319,161077,12972,男人就要对自己狠一点，狮子的这个新发型说实话还有点小帅呢！,https://b23.tv/BV1ib411T7bt
3,1554393600,这个水果长得真漂亮，不如做成【水果奶酪三明治】吧~嘻嘻,1554880873,爱做饭的芋头SAMA,2122632,144826,3362,这世上还有什么比新鲜的水果三明治更美好的吗？那就是一颗善良的心。,https://b23.tv/BV19b411T7a7
3,1554393600,【七代小丑/踩点/混剪/高燃】前方高能！欢乐与惊悚的踩点视觉盛宴！希斯莱杰诞辰40周年纪念。,1554341020,迪亚瓦尔Diaval,14198793,704434,36545,感谢希斯·莱杰为我们带来如此经典的银幕形象，愿你安好。,https://b23.tv/BV1Jb411W7dH
3,1554393600,【敖厂长】沙雕游戏主角死法超级华丽,1554957466,敖厂长,5037296,233994,28345,恶意满满的摩托赛车游戏，制作组的重点完全放在了花式死法上啊喂→_→,https://b23.tv/BV1bb411M7G2
3,1554393600,探秘印度医药，真的有牛尿做的药吗？,1554951398,我是郭杰瑞,1371298,42892,12583,继续跟随郭杰瑞走进印度。什么？你居然敢把印度神药当水喝w(ﾟДﾟ)w,https://b23.tv/BV1Lb411M7B9
3,1554393600,华农兄弟：怀孕好几个月的香猪终于生了，一下生了9只小香猪,1554375634,华农兄弟,1716896,57074,6528,刚出生小香猪超可爱啊，好想抱一只回家，再过几个月就可以....( ‵▽′)ψ,https://b23.tv/BV1pb411W7iY
3,1554393600,电影最TOP 123: 难以超越的奇幻史诗巨制《指环王》三部曲,1554899415,电影最TOP,2368018,129149,47896,一小时重温影史经典《指环王》系列。不论再看多少遍，感动与震撼依旧。,https://b23.tv/BV1db411T7He
3,1554393600,和日本妹子结婚要花多少钱？日本的收入情况up听到后惊呆了。。。,1554536915,纳豆奶奶,3777546,233751,19935,日本妹子坦露择偶标准，和你想象的一样吗？不过这和我又有什么关系呢_(:з」∠)_,https://b23.tv/BV1pb411373L
3,1554393600,年度最传奇动画！一集封神开创沙雕时代！看完笑疯了！,1554599585,LexBurner,4032170,272644,19361,放送延期超过一年的动画会崩成什么样？且看蕾丝带你细品旷世神作《原书·原书使》。,https://b23.tv/BV1Xb411M79G
3,1554393600,【党妹】如此颜值与实力双双爆表还便宜大碗的神仙彩妆是真实存在的吗！KIKO2019春季限量/樱木党道为你在线测评,1554475109,机智的党妹,1723558,130866,18989,天气逐渐转热，是时候给自己换个春季妆了。樱木党道替你在线测评神仙彩妆！,https://b23.tv/BV1cb41137A9
3,1554393600,【老番茄】史上最骚杀手(第三集),1554258253,老番茄,15439179,1093325,53006,职业杀手（雾）大光头这次来到了哥伦比亚村庄，他会以怎样奇葩的方式达成目标呢？,https://b23.tv/BV1Nb411W7uN
3,1554393600,DC超强反英雄「黑亚当」科普，《雷霆沙赞2》反派就是他了！,1554890426,努力的Lorre,1313687,38421,2460,看完《沙赞》是不是还有些意犹未尽？来了解一下DC漫画中的真反派吧。,https://b23.tv/BV1wb411M73A
4,1554998400,巴黎圣母院遭遇严重火灾损失惨重 法国总统马克龙含泪宣布重建,1555380666,小央视频,737314,10327,4459,这是一场全世界为之揪心的大火。愿文物都能够远离灾难，代代传承。,https://b23.tv/BV1nb411j7Dc
4,1554998400,巴黎圣母院重建，《刺客信条》或将提供参考,1555399797,观察者网,559870,11273,1128,在巴黎圣母院暂时离开的这段时间里，至少还能在游戏里与她相见。,https://b23.tv/BV1tb411j7Rq
4,1554998400,体验在印度最大的贫民窟生活一天,1555306646,20岁了还没去过星巴克,3792852,182111,27412,在印度贫民窟住上一晚绝对是需要勇气的，UP主我敬你是条汉子。,https://b23.tv/BV1Pb411j7dE
4,1554998400,【城市拟人】《江山行歌》排骨教主/银临/winky诗/不才/三无MarBlue/KBShinya,1555057702,共青团中央,1485060,140808,27047,音乐区UP主联合出品，江山行歌尽显历史名城风光。你的城市也在这首歌里吗？,https://b23.tv/BV1Hb411K771
4,1554998400,字体侵权，我赔了10万元。他们算版权流氓吗？,1555168007,毒角SHOW,4817750,248074,18888,知名UP主意外收到律师函？且听角角用血泪教训为大家讲解字体版权规范。,https://b23.tv/BV1db411K7f6
4,1554998400,龙头烧烤器,1555423282,手工耿,2908901,129829,9981,耿哥出品的最新神器，戴上之后立刻变身酷炫喷火龙，看完想马上拥有一个。,https://b23.tv/BV1zb411j7Lb
4,1554998400,【央视段子手】朱广权：我就是要用rap播新闻！,1555058207,鋃月,3936396,292928,12278,朱广权rap新单曲，又帅又有才唱歌还好听的央视段子手谁不爱呢？,https://b23.tv/BV1Hb411K77s
4,1554998400,华为P30天文望远镜试用，月亮上的陨石坑到底有没有造假,1555416077,小狼TOWER,1702994,47630,11086,潜望式摄像头+天文望远镜真能拍到月球陨石坑？答案等你自己来揭晓！,https://b23.tv/BV11b411j7to
4,1554998400,什么鬼套路：LOL史上最强回血套路  万毒归宗！！！,1555318259,点滴菌,7515866,305408,23999,回血套路握在手，敌方高地横着走。对面5个英雄听着，你们被我1个人包围啦！,https://b23.tv/BV1cb411j7JQ
4,1554998400,妹子竟被逼着翻唱保加利亚妖王！⁄(⁄ ⁄•⁄ω⁄•⁄ ⁄)⁄！【喵会长】,1554999201,隔壁班的喵会长,1910505,265264,8818,震惊，居然有人用萌妹音翻唱这首歌！居然还谜之好听是怎么回事w(ﾟДﾟ)w,https://b23.tv/BV1vb411M79s
4,1554998400,一斤土鸡，一斤黑毛猪，大sao吃吊锅配大蒜，老板都呆了，真过瘾,1555410630,徐大sao,1377641,24866,6124,没胃口的时候记得来看大sao的视频！好酒好菜家人相伴，幸福可以很简单。,https://b23.tv/BV1Hb411j7Wg
4,1554998400,狂野牛仔老番茄,1555041639,老番茄,3214372,82526,13533,捏脸大师老番茄重出江湖，一身原谅色睡衣征战狂野西部。,https://b23.tv/BV1Kb411M7mB
4,1554998400,【up主变形记】看6位叛逆Up主如何在农村改造，重新做人！,1555430418,力元君,3047197,123333,7490,6位UP主，挑战5天4夜农村变形之旅，会碰撞出怎样的火花？敲碗等正片！,https://b23.tv/BV1gb41157q8
4,1554998400,猫中毒太深，主人为其运功疗伤。白胖！你能正常点吗？,1555466886,白胖过来,3153315,147487,5390,摊上这样一个沙雕戏精主人真是不容易，白胖无可奈何只有配合。,https://b23.tv/BV1ub41157D1
4,1554998400,初中到大学的爱情，你的初恋男友。,1555281487,一岚子花,525180,25103,4057,柠檬树上柠檬果，柠檬树下你和我。又是为别人的爱情流泪的一天。,https://b23.tv/BV1mb411L7uf
5,1555603200,《复联4》观影指南，6分钟极简版，4大知识点刷完21部漫威电影,1556013642,努力的Lorre,1090426,39881,4416,怎样让路人朋友快速走进漫威电影宇宙？有这个视频就够了！温故知新，观影必备。,https://b23.tv/BV1Xb41137Po
5,1555603200,【漫威/复联4/合作混剪】终章：终局之战,1555875024,萌萌中自有天意,786237,59417,2989,神仙转场+超强踩点，他们就是地球最强英雄团队。看完又想再刷一遍复联4了。,https://b23.tv/BV16b41137KX
5,1555603200,【ONLee】把男友化成抖森洛基去看《复联4》首映，路人的反应是...,1556106754,ONLee_Studio,1402905,49183,7813,去影院看电影居然自带洛基，还顺便秀了一波恩爱，这回真的是羡慕了。,https://b23.tv/BV1t441187wJ
5,1555603200,B站专访《复联4》剧组：美国队长念bilibili太可爱！,1555616744,哔斯卡金像奖,3052533,102124,12504,哔哩哔哩独家采访片段放出！影迷关心的问题我们都问了，来听演员本人的回复吧。,https://b23.tv/BV1Kb411L7km
5,1555603200,大碗宽面（动画版）- 吴亦凡,1555643271,大家的音乐姬,12601490,710227,173127,官方玩梗最为致命，结尾高能千万别错过。本歌已加入我的单曲循环列表！ ,https://b23.tv/BV1Hb411L71C
5,1555603200,papi酱读书日特别篇——荒诞派戏剧四部,1555927237,papi酱,2128402,92328,19515,读书最重要的是兴趣和热情，如果这四部作品勾起了你的好奇心，不妨去试着读一读吧。,https://b23.tv/BV1qb41137gd
5,1555603200,[LPL春季赛] 4月21日 IG vs JDG,1555835021,哔哩哔哩英雄联盟赛事,3549237,41013,74268,恭喜IG！在经历了13个赛季的蛰伏之后，终于等来了自己的首个LPL联赛冠军！,https://b23.tv/BV1wb41157jT
5,1555603200,日语版《绿色》好听爆哭预警！！超火神曲秒变日剧主题歌awsl？！,1555669221,O2O男团,2411565,80736,16204,美少年音演绎最新热曲，日语填词和翻唱都很棒，收藏了！,https://b23.tv/BV15b411L7rX
5,1555603200,如果把《西游记后传》去掉回放，它还好不好看？,1555985041,神烦XP,2367610,93867,13519,一部被鬼畜光芒掩盖的童年经典电视剧，剧情和人设放在今天依然创意十足,https://b23.tv/BV1Vb411G7mq
5,1555603200,【老徐的奇妙冒险】只狼真好玩嘿嘿嘿嘿嘿嘿嘿嘿嘿嘿嘿嘿嘿！,1555745818,靠脸吃饭的徐大王,2277568,146587,9343,徐老师亲身示范如何把《只狼》玩成一款搞笑游戏。逃课有风险，打铁需谨慎。,https://b23.tv/BV1Vb411V7F9
5,1555603200,如何5秒钟把一首歌变土,1555577527,朴冉,7207783,335181,35769,优秀的调音师不仅能化腐朽为神奇，更能瞬间把歌变土。你学会了吗？,https://b23.tv/BV1Sb41157BK
5,1555603200,立体雨伞如何折？简单易学还可以收缩，一步一步教你,1555893258,手工小匠,1141416,93873,4904,“一看就会，一做就废”说的就是我这种人吧。还是看别人做手工赏心悦目啊！,https://b23.tv/BV1kb41137ty
5,1555603200,童年最变态游戏关 12年前劝退无数玩家的噩梦！,1555614641,神秘店长A,2177665,69351,14196,小时候打不过的游戏，现在依然打不过去。这才是最悲催的事情吧_(:3」∠)_,https://b23.tv/BV1Kb411L79v
5,1555603200,日本宝矿力校园爆燃CM一镜到底广告《宝矿力蓝色之舞 灵魂的呐喊》！,1555906781,瘫倒的Aqua,3040782,145325,5093,让人看上瘾的超强创意广告。一镜到底震撼力十足，精彩程度堪比MV。,https://b23.tv/BV1vb41137R5
6,1556208000,国产最沙雕的真人版只狼！,1556535652,森纳映画,3396492,209201,14050,原本以为是硬核拍摄，点开一看过于沙雕！实在是高成本大制作啊哈哈（狗头）,https://b23.tv/BV1w441187oh
6,1556208000,【种族天赋】当丈夫回家遇见老婆和她的男朋友,1556656090,伊丽莎白鼠,5866227,295677,27105,失踪人口回归！打开洗脑循环ing,https://b23.tv/BV1t4411t7C8
6,1556208000,沙雕至极！这动画承包了我今年全部的笑点！,1556441006,LexBurner,6859784,361009,55002,19年开年烂番：女主笑容的代价，原来是观众们悔恨的泪水啊！,https://b23.tv/BV1y4411b7WX
6,1556208000,钢铁侠始，钢铁侠终！爱你三千遍！十年终落幕，无悔入漫威！,1556019728,战场ヶ原-,4701582,241091,23745,血肉之躯，钢铁之心，以人之力，脚踏神明！,https://b23.tv/BV1jb411G7Ks
6,1556208000,竟有两个美队？完全理清《复联4》时间线，搞懂这部电影！（含剧透）,1556369857,努力的Lorre,1673262,55315,15406,剧透慎入！看完首映的你，在二刷前一定需要先看这个视频！,https://b23.tv/BV1s4411b7Qx
6,1556208000,【咬人猫】勾指起誓❤️ 初次自唱跳~原创舞蹈o(*≧▽≦)ツ,1556424324,=咬人猫=,6715107,222018,16991,喵酱.......也太美了吧 (੭*´ᐜ`)੭,https://b23.tv/BV1s4411h7ou
6,1556208000,【老番茄】史上最骚杀手(第五集),1556034813,老番茄,14664063,773075,68140,C菌友情客串配音。最后一季，太不舍了！,https://b23.tv/BV1ab411G7Rs
6,1556208000,B站宝贝,1556337326,异次元臭豆腐,5853950,425290,26194,弹幕大型玩梗现场。火钳刘明！,https://b23.tv/BV1B4411h7LY
6,1556208000,如何用一只猫来制作音乐,1555804567,黄布林布林,674707,87447,7178,UP主如果你被猫绑架挟持了就眨眨眼，我们好去救你……,https://b23.tv/BV1vb411V7Qc
6,1556208000,【敖厂长】难度超变态的沙雕游戏,1556467222,敖厂长,4245671,176512,18617,众所周知，玩沙雕游戏的人最终都会变成沙雕……,https://b23.tv/BV1v4411h7ya
6,1556208000,《火影忍者博人传》沙画动画极限2000幅，沙子绘制的动画效果炸裂堪比原作！,1556053438,玉译沙画工作室,1308710,265341,11201,惊了！这真的是用沙子画的嘛？！神仙画神仙打架！,https://b23.tv/BV1eb411G7EV
6,1556208000,【党妹】LolitaFashion|128块就能买到神仙lo裙？7条白菜Lo裙开箱测评，下水道女孩也要一样可可爱爱！,1556543376,机智的党妹,2940333,235510,43444,平价LO裙，瞬间真香。党妹真是太好看了！爱了！,https://b23.tv/BV1y441147CG
6,1556208000,《纸人》猎奇文化向解说01丨乌盆记.,1556427650,小熊flippy,1377876,111490,39829,妈妈，我居然在恐怖游戏里面学习历史和语文_(:3」∠)_,https://b23.tv/BV1q4411b7rD
6,1556208000,华农兄弟：出生20多天的小狗会走了，肥嘟嘟的，带它们晒晒太阳,1556595615,华农兄弟,2315877,77068,25432,点击就看，超萌奶狗！中华田园狗真的好可爱！,https://b23.tv/BV1B441147XL
7,1556812800,电影《大侦探皮卡丘》玩整版1080P,1557295814,哔哩哔哩游戏中心,15909043,685773,162084,电影全程无尿点，剧情出乎意料，看完就是赚到！,https://b23.tv/BV1J4411v7cK
7,1556812800,某大学生穿上高中校服偷偷溜进高三某班，会发生什么？（差点被班主任赶出去）,1556699393,拉宏桑,3916208,162696,29143,很多人都幻想过这么做吧，高中时光虽然短暂，却是一段最难忘的回忆。,https://b23.tv/BV1v4411t7h5
7,1556812800,【真人版 ▪ 铁锤爬山】地狱级挑战，真的能成功登顶吗!!?,1556958185,J-Bao頻道,2526165,269649,11765,大庭广众之下体验真人版掘地求生，UP主我欣赏你的勇气和...体力。,https://b23.tv/BV1Z4411v78J
7,1556812800,《蜘蛛侠：英雄远征》超级预告惊爆来袭！延续复联燃战今夏！,1557151044,鲲鹏万里-漫威加载中,2065161,53407,3858,复联4并非漫威电影宇宙的终点，今年夏天我们电影院见！,https://b23.tv/BV1H4411e77i
7,1556812800,我连一秒都没有拥有过她，却感觉失去过她千万次。,1556787406,永远的我的鸟笼Me,14868570,756602,140694,MAD之所以吸引人，是因为能够让观众产生共鸣。视频传达出的情感，你感受到了吗？,https://b23.tv/BV184411x7uq
7,1556812800,什么鬼套路：LOL史上最莽套路 冰火九重天！！！,1557309703,点滴菌,4495308,242312,24077,在罗老师的新套路面前，对面心态又一次崩了。有脑子的莽夫果然最可怕。,https://b23.tv/BV154411v7Gg
7,1556812800,一个高中生的无聊成果（5），火柴人,1556625632,小徐春风润物,1583512,207428,2896,课本上的小人都谁画过，但要做成翻页动画就另当别论了。这打斗场面，是大片的感觉！,https://b23.tv/BV1V4411t7eY
7,1556812800,来自沙雕室友的神奇电话 我笑哭了,1556614506,chshh,10323264,511778,32302,万万没想到童年的动画角色居然在B站对唱金曲，这同步率是怎么回事？,https://b23.tv/BV16441147Qx
7,1556812800,给女朋友看自己的手办会被揍吗!?,1556885201,真田康康君,1008019,18632,3123,你以为是炫富，其实是秀恩爱哒！请妹子下次下手重一点，谢谢。,https://b23.tv/BV1s441147kB
7,1556812800,高铁商务座和普通座到底什么区别，一节车厢竟只有5个座位，太爽,1557051611,翔翔大作战,2174987,42574,10296,比飞机还贵的高铁商务座长什么样？跟着翔哥体验一把土豪的感觉。,https://b23.tv/BV1x4411i7cK
7,1556812800,妈妈问我lemon用中文怎么唱,1556786219,梅尼耶大师,1582318,76460,7037,又搞笑又好听的翻唱，清嗓之后的声音判若两人，关注了！,https://b23.tv/BV184411x7Km
7,1556812800,漫威十年，I AM IRONMAN,1556799805,努力的Lorre,1726920,113945,14718,漫威十年自他而始，由他而终。钢铁侠或许已经谢幕，但他的传奇还在继续。,https://b23.tv/BV114411x7kq
7,1556812800,【全明星】Counting Stars,1557194437,柴可夫司徒,2689171,238400,19826,全明星系列新曲，吹爆填词和调音。拔剑吧，音乐区！,https://b23.tv/BV1H4411e7xa
7,1556812800,腾讯天美手游《见》口碑爆炸 玩家：感动哭了,1556697575,独立菌儿,4021356,264882,14954,在游戏里体验视障人士的日常出行，你就会明白他们的生活有多么不易。,https://b23.tv/BV1h4411t7dW
8,1557417600,世上有几人能活到这短片结束？,1557476507,尽整没用的,22306580,1295662,517010,哀吾生之须臾，羡长江之无穷。你可曾想象过人类消失后的宇宙会是什么样？,https://b23.tv/BV1z4411Y7tX
8,1557417600,大碗宽面（Live）- 吴亦凡,1557734602,大家的音乐姬,5377228,211045,37893,没人能够把你定义，快乐才是真谛！结尾高能超级好评。,https://b23.tv/BV1h4411a7F9
8,1557417600,前方高能！来自雨天的盛宴，极致画质的巅峰，请备好你的硬币,1557626808,雪莱咚,4051958,248187,8179,淅淅沥沥的雨点总是让人思绪万千，一起来感受只属于雨天的美好吧。,https://b23.tv/BV1Z4411h7bf
8,1557417600,教你控制自己的梦，你可以无所不能，《盗梦空间》现实版【捕月说26期】,1557556241,捕月说,2761850,121025,29436,时至今日，人类对梦的了解仍然很少。你也曾有过清醒梦的体验吗？,https://b23.tv/BV134411e73m
8,1557417600,【治愈/萌/看完要超开心哦！】不要忧虑，要开心！【1080p/混剪】,1557816117,白日妄想家,1694805,112486,3007,这些年的影视萌物角色大集结，总有一个能够俘获你的心。,https://b23.tv/BV1k4411E7eV
8,1557417600,【C菌】资深女玩家的高科技游戏公寓！,1557482703,渗透之C君,2290471,168320,20256,科技风满满的游戏快乐屋，看完之后从心底发出了羡慕的声音。,https://b23.tv/BV1M4411Y78W
8,1557417600,被罚抄一百遍课文，这支笔一秒就可以写完！？,1557479153,贤宝宝Baby,1356292,43121,2550,学生党的罚抄神器终于出现了，但是首先你要有一个超大作业本才行啊喂。,https://b23.tv/BV164411Y7uC
8,1557417600,【Aliga】人工智能爱酱❤️AIAIAI❤️一次满足你三个愿望,1557252463,矮乐多Aliga,3028499,120011,7331,三个爱酱三倍可爱，那么问题来了：你最喜欢哪一只呢？,https://b23.tv/BV1M4411v7WP
8,1557417600,华农兄弟：突然想吃粽子，摘点粽叶，抓只竹鼠，包竹鼠味的粽子,1557959448,华农兄弟,3136014,111236,55294,竹鼠的一万种吃（si）法又更新了，提前预祝大家端午节快乐！,https://b23.tv/BV1n4411J7LS
8,1557417600,【英语高能RAP】你从未看过的家有儿女英文版 !,1557581493,一鸣の,799797,52907,2245,我怀疑UP主英语是散装的，而且证据确凿。前排坐等大佬的翻唱。,https://b23.tv/BV1L4411e72s
8,1557417600,【敖厂长】云玩家在伤害游戏?,1557978427,敖厂长,3621533,168784,18260,比起“云玩家”，不负责任的言行或许才是伤害游戏的真正元凶。,https://b23.tv/BV1e4411J736
